{
  "name": "skills",
  "version": "1.4.0",
  "description": "A Claude Code plugin marketplace. Every machine-specific value is read from local configuration at run time and never committed; see the repository README for the configuration contract.",
  "owner": {
    "name": "nasimubd",
    "url": "https://github.com/nasimubd"
  },
  "plugins": [
    {
      "name": "custom-statusline",
      "description": "Multi-line Claude Code status line driven by the statusline JSON payload plus GitHub-derived repository signals.",
      "version": "1.4.0",
      "source": "./plugins/custom-statusline",
      "category": "productivity",
      "author": {
        "name": "nasimubd",
        "url": "https://github.com/nasimubd"
      },
      "keywords": ["statusline", "git", "github"]
    },
    {
      "name": "norn-agent",
      "description": "Install and operate Norn, a local-first runtime for routing natural-language tasks across tools, models, desktop automation, and approval gates.",
      "version": "1.4.0",
      "source": "./plugins/norn-agent",
      "category": "productivity",
      "author": {
        "name": "nasimubd",
        "url": "https://github.com/nasimubd"
      },
      "keywords": ["norn", "agent-runtime", "argus", "agent-s", "automation"]
    },
    {
      "name": "teams-commander",
      "description": "Draft Microsoft Teams messages where every factual claim is backed by evidence you can see, then open the chat in the Teams app with the message on your clipboard.",
      "version": "1.4.0",
      "source": "./plugins/teams-commander",
      "category": "productivity",
      "author": {
        "name": "nasimubd",
        "url": "https://github.com/nasimubd"
      },
      "keywords": ["teams", "microsoft-teams", "messaging", "evidence", "provenance", "deep-link", "developer-productivity"]
    },
    {
      "name": "automation-scaffold",
      "description": "Scaffold a release-ready repository for a Power Platform, n8n, Make or Zapier automation from what runs in production: discovery with evidence, standard layout, git protocol, first release.",
      "version": "1.4.0",
      "source": "./plugins/automation-scaffold",
      "category": "devops",
      "author": {
        "name": "nasimubd",
        "url": "https://github.com/nasimubd"
      },
      "keywords": ["scaffold", "power-platform", "power-apps", "power-automate", "n8n", "make", "zapier", "semantic-release", "conventional-commits"]
    }
  ]
}
